{
  "schemaVersion": "1.0.0",
  "status": "draft-not-consulted",
  "authority": "project-draft-only",
  "consultationSessions": 0,
  "recordedReviews": 0,
  "ratificationRecords": 0,
  "liveConnectorsGate": "closed",
  "lastUpdated": "2026-08-30",
  "notes": [
    "No worker, workplace representative, NUJ body, or other trade union has been recorded as consulted.",
    "No endorsement, agreement, or ratification is claimed.",
    "Preparation of a co-design pack does not advance consultation status."
  ]
}
